REVIEW_ID,APP_ID,PACKAGE_NAME,RATING,REVIEW_DATE,REVIEW_TITLE,REVIEW_TEXT,REPLY_TEXT,REPLY_DATE,REVIEWER_NAME,CATEGORY,PRIMARY_CATEGORY,SUBCATEGORY,PRIMARY_SUBCATEGORY,REPLY,HANDLED,IS_FREE
109415492,45668,de.gmx.mobile.android.mail,4,2018/9/9,,Works good but photo back up does not work unless on wi fi,Dear GMX User  Thank you for your feedback. Please make sure that you enable automatic upload for photos and videos in the settings also for cellular data back up . Regards GMX Team,2018/9/10,Bunny Rabbit,appearance,appearance,typography,typography,,,1
106200603,37521,com.rosberry.splitpic.newproject,1,2018/8/10,,Please you guys need to work on this app... Worst photo app i have come across.. This app is so terrible it has no rotation.. Worthless,Hi Oge sorry for the inconvenience! We are working on the app improvements and we`ll have your suggestions on mind!,2018/8/10,oge lizzy,appearance,appearance,typography,typography,,,1
52529414,5830,com.sygic.aura,3,2017/11/16,,Maps are good and UI is also good. But New search engine of sygic is not better than google maps. Because it cannot search most of the places and restaurants in pakistan. In comparison google maps search engine is much better and can search almost all places in pakistan.,Hello we are currently looking for a solution concerning Pakistan's map which is why we would like to ask you for your patience. We understand that the quality of the maps impact your experience which is why we would like to improve them. If you have questions feel free to contact us at urgentsupport@sygic.com. Rudolf from Customer Care,2017/1/29,Dr.Syed Inayatullah,appearance,appearance,typography,typography,,,1
115252672,21827,com.eco.textonphoto.quotecreator,3,2018/10/22,,After adding text to high res photos with this app the text has great resolution but the photos become granular and look terrible printed. Regarding functionality there are some fonts that are mixed up so what you think you ate selecting is different than the sample shown.,Yes thank you for your input. We will continue to develop the writing application better. And update the fix you are encountering as quickly as possible.,2018/10/23,Angela D,appearance,appearance,typography,typography,,,1
107796408,41527,com.thisclicks.wiw,5,2016/12/14,,I love that it notifies me the day before my shift! I also love the email notifications that let me know a new schedule is out as well as canceled shifts. So quick and easy to use!,Hi Breanne- Thanks for writing us a review! We're glad to hear you are enjoying the app!,2016/12/15,Breanne Barlow,appearance,appearance,typography,typography,,,1
115606842,51604,uk.co.aifactory.backgammonfree,3,2018/10/25,,Nice GUI  but 100 percent sure cpu is cheating  i delete it after about 1 year play,Thank you for your thoughts but absolutely none of our apps cheat. We create games with total integrity with some used in serious academic research. This app has also been tested by 3rd parties to verify fairness and we simply have nothing to gain from unfair play.,2018/10/26,Alireza Tabatabaee,appearance,appearance,typography,typography,,,1
99024536,19535,com.coquisoft.parentlove,5,2018/7/1,,Love the app. Very easy to use.... easy to track... no more guess. Happy I found this.,Hi Cheka!  Thanks soo much for your review! We appreciate it and are thrilled to hear you love the app and find it easy to use :) If there is anything we can do for you please tap 'Contact Us' in the app. Wish you and the family all the best! Ant,2018/7/1,cheka meka,appearance,appearance,typography,typography,,,1
106944457,39377,com.songkick,1,2018/7/27,,The app doesn't work on my Google Pixel. Just sat there on a frozen screen. I found it more useful to search the website while logged out.,Hey Kimberly  We just thought we d let you know that we've released a new version of our Android app which will fix the bug that you were experiencing during your artist import on Songkick. We so hope that you can find value in Songkick again moving forward and of course just let us know any feedback that you may have along the way!,2018/10/8,Kimberly Jayne,appearance,appearance,typography,typography,,,1
116010996,39199,com.snapfish.mobile,2,2018/10/23,,It took 3 weeks to get my photos. Ehen they did come most of them were bad quality.,We're disappointed you weren't happy with your prints Danelle. We want you to be satisfied with your order so don't hesitate to reach out to CS via the app or at www.snapfish.com/help,2018/10/23,Danelle Null,appearance,appearance,typography,typography,,,1
101351543,25322,com.google.android.apps.kids.familylink,5,2017/6/6,,Very easy to use,Thanks Daniel!,2017/6/7,Daniel Friday,appearance,appearance,typography,typography,,,1
113617830,56796,com.DWS.rvtrader,1,2018/1/29,,Not able to view pictures.,Sorry to hear this Jen. Could you provide me with your search parameters or perhaps the listing that you were looking at?,2018/2/6,jen kom,appearance,appearance,typography,typography,,,1
105346899,35432,com.pictarine.photoprint,4,2018/10/14,,It's super simple for busy parents to select some photos quickly and have them ready within the hr.,Hi Thank you for a great review. As you only gave us 4 stars could you please help us to make the app better by specifying what went wrong?,2018/10/15,mommy c,appearance,appearance,typography,typography,,,1
118879859,35857,com.plutus.wallet,5,2018/11/5,,Very easy to use. Highly recommended.,Hi Larry- That is fantastic feedback we appreciate the 5 stars as well. Your experience is extremely important to us as well as your feedback. If you need anything please email support@abra.com at any time.  Cheers  Ahmed,2018/11/5,Larry,appearance,appearance,typography,typography,,,1
115067361,40798,com.tasks.android,5,2018/10/20,,Amazing just what I was looking for. Modern UI fast flexible. The only feature I may really love is to be able to put tasks in groups rather than putting all of them in a single tab,Hi Ali you could use sub tasks lists for this purpose. There is a small + button (top right). I hope this helps Steve,2018/10/20,Ali Kasasbeh,appearance,appearance,typography,typography,,,1
103229064,30056,com.lemurmonitors.bluedriver,5,2018/7/16,,It's awesome for what it's designed to do.,Thanks! If anything ever comes up you can get us any time through the app (more contact us email) or at BlueDriver.com,2018/7/20,Tim Olson,appearance,appearance,typography,typography,,,1
115900484,57249,org.vystarcu.mobilebanking,1,2018/10/26,,Cannot screenshot. I need proof that certain payments went through but this app disabled screenshots. Not helpful at all,Hi there thank you for your feedback. As a work around please log into the Full Internet Banking Site using the link on the login page. You'll be able to take screenshots this way.,2018/10/29,Boranavin360,appearance,appearance,typography,typography,,,1
100441763,23274,com.flowers1800.androidapp2,5,2017/10/15,,Great App. Easy to use. Only wish it allowed you to save checkout items after you sign out.,Hi Cole thank you for your suggestion! I will forward your suggestion to our developers. If you have any feedback you would like to share please email us at MobileApp@1800FLOWERS.com -Greg,2017/10/16,Cole Merlin,appearance,appearance,typography,typography,,,1
110384491,48500,mrigapps.andriod.fuelcons,4,2017/12/26,,Great User friendly app lots of handy settings for tailoring the dashboard. Only downside is no fuel economy results unless you always fill the tank 100% everytime. Surely it can calculate partial tanks based on quantity of fuel distance travelled and cost??? The same as it does for a full tank? Other than that it's great,Calculation of partial tank is only possible on the next full tank fill up. You can check Help &gt; FAQ for an explanation.,2017/12/26,Iain Cannon,appearance,appearance,typography,typography,,,1
96609970,12536,com.AUTORUS.ProjectJDM,3,2018/9/10,,After updating the game has become better but the online has some problem. After few seconds the screen becomes blank please fix this issue,Hi Nithine please update the app to it`s latest version and try it again! If you still experience the same problem write to us again here or on e-mail support@osypo.com,2018/5/28,Nithine Balajee,appearance,appearance,typography,typography,,,1
113343640,56199,com.slots.best.android,5,2017/5/9,,It speaks for itself easy to use and just like the reall deal. Thought it is free. If we dont have coins then we must purchase. Otherwise must wait upto 4 hours for free bonuses,Hi! We're so glad you're enjoying our free slots! Happy gaming and good luck!,2018/11/1,John Eid,appearance,appearance,typography,typography,,,1
110338463,48341,mobi.infolife.ezweather.widget.ripple2,5,2017/12/10,,Excellent and easy to use,Hi thanks for your praise for Local Weather Widget&Forecast and we also recommend other app to you in store which may bring surprise to you and you can also introduce the app to your friends if you really love it at last we appreciate your encouragement again!,2017/12/10,A Google user,appearance,appearance,typography,typography,,,1
96838445,13514,com.Suborbital.CircuitScramble,5,2016/10/29,Helped me in amazing ways,I'm currently in school for basic electrical training and this game has helped me understand logic gates more than my teacher ever could! Thank you a thousand times over!! P. S. You should have a screen pop up explaining the spinning yinyang as an inverter.,Hi Jack! Thanks for your feedback! I'm really glad you're enjoying the game and that it's helping you out. The original idea actually stemmed from a digital logic course. Also there appears to be an issue with that tutorial not appearing properly. I will be addressing that soon. Thanks again!,2016/10/29,Ptero Jacktyl,appearance,appearance,typography,typography,,,1
102540956,28332,com.jet.jet.app,5,2018/6/28,,Very easy to use and well made.,That's too nice of Allison we're blushing. ,2018/6/28,Allison Cote,appearance,appearance,typography,typography,,,1
114067263,14224,com.alarmclock.xtreme.free,1,2018/10/19,,Since the change to the new screen I have trouble reading the name of the alarm. It just does not stand out anymore. What a waist.,Hi Lian we are planning to fix this. Thanks for your patience. Tereza*AVG,2018/10/20,Lian Thurston,appearance,appearance,typography,typography,,,1
114840237,57792,com.mitosisgames.match3,1,2018/8/20,,Needed to get 4 cupcakes to the bottom on the screen. Only 3 ever showed up before I ran out of moves.,Some of the cupcake levels are tricky! The sooner you clear out the first cupcakes the sooner the other cupcakes can make it down to the screen.,2018/8/21,Jonathan Ouimet,appearance,appearance,typography,typography,,,1
97352024,15040,com.apalon.weatherlive.free,1,2018/9/29,,Too much advertise and tricky screens to make you buy subscription,The application does not initiate a payment unless you subscribe for Premium. If you had a free trial and haven t cancelled it the account should have been charged only after the end of the trial period and then automatically according to the duration of your subscription plan. You can always cancel it in Play Store - Subscriptions.,2018/10/1,A Google user,appearance,appearance,typography,typography,,,1
109867069,47120,io.fusetech.stackademia,5,2018/6/26,,Great app. It is easy to use for keep tracking the latest publications. Thanks a lot.,Hi Fatin  Thanks for the review I'm glad that you enjoy using Researcher.  Thanks Joe from Researcher,2018/7/9,Fatin Saiha,appearance,appearance,typography,typography,,,1
119821479,12166,cast.video.screenmirroring.casttotv,4,2018/6/10,,The app is awesome but I suggest Inshot Inc. to add the feature of screen mirroring,Thanks for your feedback. We are not a mirroring app. But we will consider your needs and suggestions and try to optimize our app. We will add web cast function in the future. If you have any specific suggestions feel free to contact us at videostudio.feedback@gmail.com,2018/6/10,Manohar Hepat,appearance,appearance,typography,typography,,,1
103322571,30249,com.limitlessfun.vikingvillage.free,5,2018/1/1,,regarding the grey screen it is gone now works like a charm,That bug is fixed in the latest version - 5.4+. Please check it out and thank you for the review! Edit: Glad to hear that. Thank you!,2018/1/1,Ivan apina,appearance,appearance,typography,typography,,,1
111808426,52590,com.appointfix,5,2016/6/2,,Very user friendly app. When I had a tech question sent email with quick fix response. Thank you!,Thank you Nicole!,2016/6/3,Nicole Alestock,appearance,appearance,typography,typography,,,1
99310266,20433,com.denite.watchface.blackmetal,2,2016/11/16,Invasive permissions,Nice design but this app requests invasive permissions (why the hell do you need to run at startup??? Other interactive watch faces don't and those work just fine). Uninstalling.,If you want to receive battery/weather updates it needs to run at startup.,2016/11/16,AdDiCt Zorz,appearance,appearance,typography,typography,,,1
100405443,23177,com.fivemobile.thescore,5,2018/10/1,,I love this sports app easy to use real time updates you can follow multiple teams on multiple leagues and you can customize the notifications to thu our liking.,Happy to hear that Alex! Thanks for the kind words! - AW,2018/10/1,Alex Torres,appearance,appearance,typography,typography,,,1
114132918,42704,com.ubercab.driver,2,2018/10/18,,Horrible compared to the old one notification noises are easily missed if not paying enough attention and the layout of this app is very hard to navigate. The old app was much more accessible.,Hi Brandon this certainly sounds like a frustrating experience. Let's make sure we follow up with you regarding this issue. Send in a quick note to t.uber.com/drivercontact and we'll connect.,2018/10/26,Brandon Tveit,appearance,appearance,typography,typography,,,1
111571151,52061,xyz.klinker.messenger,2,2018/10/4,,I'm not sure what to think yet. I love the interface and features but ever since installing this app my Galaxy S7 has been rebooting randomly. The app will freeze up and then my phone reboots. Such a shame too. Anybody else experiencing this same issue? **Update 10/03/18** After a previous update my phone stopped randomly rebooting so I'm not sure if it was the app or not. I have grown quite fond of this app the only thing I've noticed is that messages will seem stuck on sending on the web interface and won't actually go through because I never see them on my phone. I have to refresh the webpage and resend the messages. Still a pretty decent app for the value.,Only two stars though?,2018/10/4,Jimmy Hernandez,appearance,appearance,typography,typography,,,1
118212953,35839,com.plotgen.rramirez.plotgenerator,3,2018/11/4,,Very huge deal-breaking issue: Screen switching from ladscape-portrait closes whichever tab I'm working on. If I tilt my device whether by accident or intentionally and it switches viewing mode the app kicks me back to the projects page wiping all unsaved data. Not sure why this hasn't been patched...,Oops that's bad! I had no idea. I'll fix it then don't worry but you may want to block the orientation of your phone while using this app. Yep annoying but will patch it until I fix it. I guess I created this issues when including tablets support. Thanks for the spot!,2018/11/4,Xiong Her,appearance,appearance,typography,typography,,,1
60835089,7079,flipboard.app,3,2017/5/10,,Think the app is not friendly and is not easy to read top stories. I Dont like the interface.,We appreciate the review Rafael. Which parts of the interface are you unhappy with? We're always looking for ways to improve the product so your feedback is important to us. Feel free to contact us from inside the app under the Help & Feedback page or email support@flipboard.com. Thanks!,2017/5/11,Rafael E,appearance,appearance,typography,typography,,,1
96319977,11690,atws.app,4,2017/9/9,,I like the new feature fingerprint login a lot! Keep it up. This app is getting better. The next one im looking for would be color configuration for those studies and be able to set alert in the same screen of the ticker(then i do not need to go alert page).,Thank you Jaz.,2017/9/11,Jaz Tai,appearance,appearance,typography,typography,,,1
107876571,41728,com.tinystep.app,5,2017/6/28,,User friendly app,Hi Gowri :) thank you so much for the review :) Have you had time to check out our post feature? Find the cutest baby posts mom queries and so much more! Help us improve the experience for pregnant and other moms by giving us your feedback. Happy parenting! Regards  Akarsha Founding Member Tinystep,2017/7/4,Gowri K,appearance,appearance,typography,typography,,,1
114781354,57667,com.skyztree.firstsmile,5,2016/6/5,Great app,Love that I can share pictures with chosen family and friends. The app also saves pictures with the baby's age  so you'll never forget!,Dear Jennifer we are so glad that you love it! Yes with First Smile you can share the happiest moments with your love ones privately & relive those precious memories by your baby's age. Please recommend to more friends about First Smile. It really helps! Thanks again & we hope that you are enjoying First Smile as much as we enjoy building it. :),2016/6/6,Jennifer Walker,appearance,appearance,typography,typography,,,1
104535232,33288,com.netease.idv.googleplay,4,2018/10/8,,Would be better if its more similar to Dead By Daylight cus I like the design of the DBD maps. Eg change the rocket chairs to hooks. Now the problem is that the ms or ping in the game is really bad sometimes the ping just shoots up and u cant do anything. Sometimes im having really good games but just get screwed over by ping.,Dear Detective. Identity V is an asymmetric competitive mobile game produced by NetEase Games. The developer studio of Dead by Daylight has agreed us to add some gameplay of Dead by Daylight in Identity V . Meanwhile the two developers of Dead by Daylight provide us with great advice and help us to make the game more globally popular.,2018/9/21,Yan Chao Ong,appearance,appearance,typography,typography,,,1
101514868,25656,com.growitmobile.growit,1,2017/5/24,,So far the user interface is beyond intuitive and I've had nothing but complaints. I like the idea of this app but it has much work to get to the point where it makes sense from a front-end user perspective. I'm also noticing that uploaded photos are overly compressed and worthless for viewing. I've spent the better part of my morning emailing support multiple times about multiple issues. I wait to see what they say. I will more than likely uninstall this app as it is cumbersome and useless at the moment.  **update ** support responded one time and it was not helpful at all. I have since sent other emails; all have been ignored. uninstalling this app and moving on,Hi Tim Thanks for the feedback. I'm not sure I've received your support emails. Will you forward them to plants@growitmobile.com? --Megan,2017/5/15,Tim Kelley,appearance,appearance,typography,typography,,,1
96594276,12479,codematics.universal.tv.remote.control,5,2018/9/4,,Edit::: ***Its working great now. Both my sony and lg smart tvs. Thanks for informing me. Good customer support. Also add support remote for other smart TVs.*** Support staff i need it for my new Sony Bravia Android TV. The android remote is not working. With my LG smart tv it is working perfectly. Good thing is that it is very easy to use. Just select your TV and use it. Nothing else. For me it worked so straight 5 stars.....keep up the good work.,Hi Its always good to know that our work is useful for our users. We are trying our very best to make available as many smart TV remotes as we possibly can. We will keep you updated. Always feel free to contact us any time for any information you need or any suggestions you have to improve user experience. Stay Happy :),2018/9/4,Waseem Javed,appearance,appearance,typography,typography,,,1
96545115,12336,co.kidcasa.app,4,2015/6/19,UX,Unfortunately our preschool doesn't use this but they should. The user interface is very well designed and the feature set is impressive.,Thanks Ali! There's now an easy way to refer your school at www.mybrightwheel.com/parents. Please submit a referral and we'll see what we can do to help :).,2016/4/25,Ali Dhanaliwala,appearance,appearance,typography,typography,,,1
118000257,24578,com.gatecity.mobile,1,2018/10/31,,It won't save my user name. Won't size properly to my screen. It feels like a crappy link to a crappy web browser instead of an actual app. I would fire the person who developed this hot garbage. The old app was  x better.,Hi Jerry! Thanks for leaving us a review. We are actively working on the username issue; we apologize for this frustration. We have a new update coming in November that we hope will improve your overall experience. If you have any additional thoughts you can email us at feedback@gatecity.bank. ,2018/11/2,Jerry Potter,appearance,appearance,typography,typography,,,1
107336567,40387,com.supertext.phone,2,2015/12/30,,THE GOOD: Clean interface. The ability to change text font and font size which is needed because from the onset the text is small and hard to read. The app has the option of choosing between a light and dark theme.  The picture message galley is a very good idea.  THE BAD: The app immediately made itself my default messaging app. Without some modification the app's default text size on my phone is unreadable.  THE VERY BAD: The app sits resident in my notification tray. I cannot get rid of it. There is no EXIT button. SUMMARY: A few good ideas here along with some uniquely bad ideas. The default messaging app is something I should choose to do myself.  Not being able to exit and thus being forced to use it or delete the app is also a poor choice to offer me because I chose to delete the app.,Thank you for the feedback J.D. We would like to help you troubleshoot this issue. What version of SimplyText did you have installed? Please contact us via the Help/Feedback link in the Settings menu in the app and please mention this review in your message.,2016/4/26,A Google user,appearance,appearance,typography,typography,,,1
108447960,43186,com.venninteractive.ssketo,5,2018/9/9,,I've been using the app for 30 days and I've lost 8 pounds which is great for me! It's easy to use and has motivated me to keep going since I've not been successful with losing weight for the past 6 years!,Debra thank you for sharing your nice review. We're really glad to hear that the app has helped you to see great results! Keep up the good work! :),2018/9/9,Debra Zaragoza,appearance,appearance,typography,typography,,,1
109266239,45213,com.zmodo,1,2018/9/10,,Using the camera system a neighbor was able to hack my camera and had access to my camera for 3 weeks! No where on the user guide does it state this could happen. Im a single mom with 3 children it makes me sick to think what this guy saw for 3 weeks I'm outrage! When i asked for our money back they said they would refund but we haven't heard from them since that was 3 weeks ago. The password was a hard one and he was only able to take control over one camera not all 4 so NO he didn't know our password and nothing on the account was changed. Your equipment is cheap where your cameras get cross wired.I can't believe your company is blaming it on passwords.,Hi Teresa! We're sorry for the unfortunate incident but the only way that a different person could access your account is if they knew your password and unbound your cameras from the account. We would recommend changing your password to something more secure. If you would like assistance with the refund policy please call us at 217-903-5037!,2018/9/5,Teresa Roy,appearance,appearance,typography,typography,,,1
105588534,35945,com.polarsteps,5,2017/5/14,,Easy to use update save etc. Best bit is updating offline to be synced when back online. Great there doesn't appear to be a limit on photos per post too! Only downside is no video upload available. Yet to see what the finished book will be like but I'm sure it will be prohibitively expensive for my ridiculously long and very many posts hahaha,Hi Alice. Thanks for this. Video will be implemented later this year so stay tuned for that. Keen to hear what you think of your Travel Book! Salut ,2017/5/15,Alice Wood,appearance,appearance,typography,typography,,,1
96905152,13724,com.aa3.easybillsreminder,4,2017/10/13,,I would be interested in upgrading to the premium version when it gets a few updates. 1. It needs the option for a dark theme 2. The ability to mark items as paid without the extra pop-up to add a note. This should be an option in the settings. 3. More customization options for the buttons. Different colors etc and there isn't a good gym button option a symbol of weights would be nice I absolutely love that there is an autopay feature to make it easier to track the ones that need to be manually paid! This is the closest app to having all the features I'm looking for. With a few updates I won't need to look for an alternative and this will be my source.,Hello  We just released a new update that includes a dark theme. Regards,2018/2/11,cmpxiong,appearance,appearance,typography,typography,,,1
103756344,31350,com.mcu.reolink,4,2018/9/3,,Something went wrong with the app when I first installed it the app worked fine with the 3g/4g on my phone now not at all. Can you fix this issue. Update the app is working properly and provides real time images and video. customer service helped a lot. Only bad thing is its only through email.,Hi T Crum thanks for your review and sorry for the inconvenience. Could you please report this issue to the support team: https://reolink.com/contact-us/ and they'd help you to solve it soon.,2018/7/26,T Crum,appearance,appearance,typography,typography,,,1
