REVIEW_ID,APP_ID,PACKAGE_NAME,RATING,REVIEW_DATE,REVIEW_TITLE,REVIEW_TEXT,REPLY_TEXT,REPLY_DATE,REVIEWER_NAME,CATEGORY,PRIMARY_CATEGORY,SUBCATEGORY,PRIMARY_SUBCATEGORY,REPLY,HANDLED,IS_FREE
99878015,21765,com.eatstreet.android,5,2018/4/21,,So easy to use.,Hey Scott thanks so much for the awesome review! We're so happy to hear you find the app easy to use. We look forward to seeing you order again soon!,2018/4/22,Scott Grewe,others,others,generic evaluation,generic evaluation,apology or appreciation,,1
114792217,57681,com.skyvin.numr.scanreceipt,5,2016/9/18,,Great easy to use,Hello Alegad We thank you for your five star comment. We are glad that our app works great for you. For any further suggestions/ comments please email us at support@numreceipt.com,2016/9/19,Alegad Silva,others,others,generic evaluation,generic evaluation,apology or appreciation,,1
113250092,55980,com.sideline.phone.number,5,2018/9/15,,First class design and usability gets you numbers when you need them and has lots of extra features.,Hey there thank you for your review. It's really amazing to hear you're enjoying Sideline so much.,2018/9/17,Barbells Sacorez,others,others,generic evaluation,generic evaluation,apology or appreciation,,1
121954664,45801,de.unp3rf3ct.JoinsTheBattleGenerator,1,2018/11/16,,This is badly designed app.,Could you please be a bit more specific? Kind regards.,2018/11/16,Shiben Chakravorty,others,others,generic evaluation,generic evaluation,information request,,1
115004934,40249,com.superevilmegacorp.game,3,2018/10/21,,This game was really good..the graphic gui...just space management really suck...people been crying for the create and save own build..dev team are really slow...u can be the top moba but u limit u own capabilities..,Hi Mohd! Thanks for your feedback. I will definitely let our team knows about it and hopefully we can embrace our limit to keep our community happy! :)  https://goo.gl/dmYEhZ Feel free to drop more ideas on the link above! Cheers :),2018/10/22,MOHD ISKANDAR Shafie,others,others,generic evaluation,generic evaluation,information request,,1
106130814,37358,com.rms.gamesforkids.painting.cars,5,2014/12/5,,Easy to use from children .,Thank you for your nice review :),2015/6/23,Arfa Medical,others,others,generic evaluation,generic evaluation,apology or appreciation,,1
102578331,28495,com.joinroot.root,5,2018/9/27,,Was easy to use informative and interesting,Glad to hear you think so Kathleen. Thanks!,2018/9/28,Kathleen Midgley,others,others,generic evaluation,generic evaluation,apology or appreciation,,1
108450636,43186,com.venninteractive.ssketo,5,2018/6/2,,Great easy to use app,Tami thanks for sharing your thoughts with us. We're really happy to hear that the app is easy to use.,2018/6/3,Tami Kirby,others,others,generic evaluation,generic evaluation,apology or appreciation,,1
98174556,17396,com.blockfolio.blockfolio,4,2018/7/27,,Great app for showing your holdings better than the apps that simply show the market. However it can be a little finicky and the UI can be improved. A widget showing the current prices and your holding values would be awesome too,Widgets coming soon! We've been working on improving all aspects of the app. We appreciate your feedback and support Daniel...,2018/1/17,Daniel Walsh,others,others,generic evaluation,generic evaluation,unspecify,,1
119560395,28495,com.joinroot.root,5,2018/11/6,,Great app easy to use love it  ,Love ya back S Bos! ,2018/11/7,S Bos,others,others,generic evaluation,generic evaluation,unspecify,,1
123302366,31878,com.mizmowireless.acctmgt,5,2018/11/23,,Easy to use!,We appreciate the positive feedback and 5-star rating Amanda! #SmileOn,2018/11/23,Amanda Williams,others,others,generic evaluation,generic evaluation,apology or appreciation,,1
114824369,57758,com.jobflex.android,5,2016/11/8,Very useful tool,I've won so many more bids with this app. I love it and it's very easy to use,Winning more bids is exactly what we want to help you do William! Glad to hear the app is working nice for you and your business. Thanks for the review!,2017/1/13,William P,others,others,generic evaluation,generic evaluation,apology or appreciation,,1
99330549,20529,com.deputy.android,5,2018/9/5,,Very easy to use  i love it,Hey Mae Claire! Thanks so much for the great review! We hope you will like it! If you have any other further feedback or suggestions always feel free to send them through to us at android-support@deputy.com.,2018/9/5,Mae Claire Verame,others,others,generic evaluation,generic evaluation,apology or appreciation,,1
103630525,30988,com.manzo.ddinitiative,4,2017/12/3,,Very user friendly and helpful.,Thanks a lot Race Ordoyne!,2017/12/4,Race Ordoyne,others,others,generic evaluation,generic evaluation,apology or appreciation,,1
40043344,9070,com.cleanmaster.security,4,2016/9/9,I like it,Good interface and performance,Innocent Boakye-Ababio If you have any questions you're welcome to contact us at cmsecurity@cmcm.com If you like our app you can really help us out by giving us a 5-stars rating    at Google Play! Thank you very much for your support. :),2016/9/9,Innocent Boakye-Ababio,others,others,generic evaluation,generic evaluation,apology or appreciation,,1
102912399,29328,com.kinsa,5,2017/7/12,,This thermometer works perfectly with my phone and takes accurate temperatures. The app is great and has places to keep important records. My tracking of this information while my son was sick was instrumental in getting him a quick diagnosis for a serious rare disease. Thank you Kinsa for an easy to use app to keep important health notes and a reliable thermometer as I'll be tracking temps for years to come unfortunately.,Hi Melissa! Thanks so much for the review. Hearing stories like yours helps us all remember we are having a meaningful part in truly helping others for our ultimate goal is to transform the way people care for themselves and to eventually help curb how some diseases are spread. Wishing you all the best in the care of your son!,2017/7/12,Melissa B,others,others,generic evaluation,generic evaluation,apology or appreciation,,1
111469482,51769,us.kjvbibleaudio.kingjames.holybible,5,2018/3/30,,nice app and also easy to use,Thank you for your excellent feedback. God bless you.,2018/4/3,deepa priya,others,others,generic evaluation,generic evaluation,apology or appreciation,,1
65141190,6278,com.ubercab,2,2017/7/16 0:00,,Love the service for many years. But since the last minor update of the app with the new design is the app very and I mean very slow.. also the new way of showing you how and when there is a surcharge is not preferable.. because of this I am forced to use a competitive app.. a shame,,,Nick van der Noordaa,others,others,generic evaluation,generic evaluation,,,1
74089457,9189,com.microsoft.office.outlook,4,2017/11/3 0:00,,Ui is simple and intuitive.,,,Bibo Chu,others,others,generic evaluation,generic evaluation,,,1
52259078,2681,com.google.android.music,2,2017/1/26 0:00,,this app is PAINFULLY ugly please redesign it ! Try to make it look even as half good as Apple music player,,,A Google user,others,others,generic evaluation,generic evaluation,,,1
29353983,2681,com.google.android.music,4,2016/5/24 0:00,,It's a very good muzik app ever. Nice features good interface I feel like playing music every time. I'm loving it.,,,Balwinder Rai,others,others,generic evaluation,generic evaluation,,,1
40559979,1908,com.ebay.mobile,1,2016/9/14 0:00,Needs a lot of improvement,No good suggestions. No good UI. App is not good!,,,Soumyodeep Karmakar,others,others,generic evaluation,generic evaluation,,,1
39251335,2012,com.estrongs.android.pop,1,2016/8/31 0:00,,It was great. The best. Used for years. Now I cant even update my podcast without file explorer getting in the way.  I'm out.,,,Andr Kittler,others,others,generic evaluation,generic evaluation,,,1
70015781,2681,com.google.android.music,1,2017/9/11 0:00,,Pathetic app never expected this from Google,,,Antriksh Gupta,others,others,generic evaluation,generic evaluation,,,1
60001725,9070,com.cleanmaster.security,3,2017/8/11 0:00,,No doubt! This is an awesome app but it should have one more feature which is ad priority. It should show only such ads which are safe for children. I hope you'll understand what I want to say.   & 1 more thing is that it doesn't scan Malware in my phone. It's just a good cleaning app not a Threat scanner. I was expecting more than it gave me. I won't say it the best Anti-virus as I said before.,,,Gurjaspreet Singh,others,others,generic evaluation,generic evaluation,,,1
40021236,5830,com.sygic.aura,4,2016/9/29 0:00,Good value,Much better value than manufacturers installed Sat Nav & updates don't cost an arm & a leg! Even carries on giving guidance when your phone falls on the floor!,,,Rod Woodworth,others,others,generic evaluation,generic evaluation,,,1
60641669,2681,com.google.android.music,3,2017/5/8 0:00,,User interface sucks....doesnt show the full album art,,,Praharsh Singh,others,others,generic evaluation,generic evaluation,,,1
57899770,473,com.alibaba.aliexpresshd,4,2017/4/4 0:00,,I love shopping at Aliexpress,,,Jessalyn Leckie,others,others,generic evaluation,generic evaluation,,,1
56800264,10177,com.reddit.frontpage,4,2017/3/21 0:00,,Intuitive interface,,,jinwei ooi,others,others,generic evaluation,generic evaluation,,,1
46911860,4844,com.pinterest,4,2016/11/26 0:00,Fantastic,Beyond my expectations!,,,Rhonda Cameron,others,others,generic evaluation,generic evaluation,,,1
45105663,1413,com.contextlogic.wish,4,2016/11/4 0:00,Convenient,By far the most inexpensive way that I have decorated my apt!! Only downside is the time for delivery and how it comes from so far away but some items deliver a lot faster than what is noted. So it's like a nice surprise in the mailbox. I definitely NO longer purchase clothing items from them after a buying a shirt that was sewn wrong sho that when I wore it it looked twisted on my torso. Only things I purchase now are home decor like wall stickers wall art etc. I'm too cynical to think about the rest..,,,AppleBomb,others,others,generic evaluation,generic evaluation,,,1
72576893,6286,com.UCMobile.intl,4,2017/10/13 0:00,,Good experience,,,A Google user,others,others,generic evaluation,generic evaluation,,,1
51603452,2657,com.google.android.apps.docs,4,2017/1/18 0:00,,Small bugs should be fixed and UI should also be changed a bit.,,,kshatriya prithvi raj,others,others,generic evaluation,generic evaluation,,,1
47485953,473,com.alibaba.aliexpresshd,1,2016/12/5 0:00,Hasan Dbouk,You are spam and pug and hucker and immoral ugly harmfull and serious virus,,,A Google user,others,others,generic evaluation,generic evaluation,,,1
57478903,5592,com.smule.singandroid,3,2017/3/29 0:00,,It's a little longer than expected,,,Sora Neo,others,others,generic evaluation,generic evaluation,,,1
57559861,9189,com.microsoft.office.outlook,4,2017/3/31 0:00,,Reasonable - works as expected.,,,Anne Chege,others,others,generic evaluation,generic evaluation,,,1
46731412,2681,com.google.android.music,3,2016/11/23 0:00,Problem,It not showing new ui,,,Sandesh Shetty,others,others,generic evaluation,generic evaluation,,,1
55127848,473,com.alibaba.aliexpresshd,4,2017/3/2 0:00,,Ali express is the best online seller in the world wide,,,HUMAYUN KABIR,others,others,generic evaluation,generic evaluation,,,1
74179366,4844,com.pinterest,3,2017/11/4 0:00,,Change d design,,,Raja Gopalan,others,others,generic evaluation,generic evaluation,,,1
47098027,6264,com.twitter.android,4,2016/11/28 0:00,,A much improved Twitter experience,,,Mark Bennett,others,others,generic evaluation,generic evaluation,,,1
29881197,3229,com.ismaker.android.simsimi,1,2017/3/28 0:00,,Ugly ,,,Waliza Ahmed,others,others,generic evaluation,generic evaluation,,,1
28799115,3175,com.instagram.android,1,2016/5/18 0:00,,New inata update sucks a big time..!! Eeeuu Totally a flop nd Rubbish attempt 2 make insta better it looks even more old skool nd   Keeps crashing all the time + interface is so outdated type..!!,,,ankit anand,others,others,generic evaluation,generic evaluation,,,1
68168039,10446,com.xvideostudio.videoeditor,4,2017/8/19 0:00,,Easy to use functions with user friendly interface...,,,IYKE KENNETHS,others,others,generic evaluation,generic evaluation,,,1
46149384,2012,com.estrongs.android.pop,4,2016/11/17 0:00,Awesome application,Use full application es explore file manager it's great work teem,,,ved verma,others,others,generic evaluation,generic evaluation,,,1
46658138,9266,com.spotify.music,1,2016/11/23 0:00,Crap UI and shuffles albums,The user interface is abysmal. Also despite having Premium it plays albums shuffled by default. Stupid. Going to cancel.,,,Matt Taylor,others,others,generic evaluation,generic evaluation,,,1
29526088,3175,com.instagram.android,4,2016/5/26 0:00,Visual expression,It's a visual expression of ourselves that can be shared without comment.,,,Lisa Van Der Merwe,others,others,generic evaluation,generic evaluation,,,1
78763250,10101,com.olacabs.customer,3,2018/1/2 0:00,,Good experience,,,A Google user,others,others,generic evaluation,generic evaluation,,,1
84269671,5592,com.smule.singandroid,4,2018/4/1 0:00,,Good experience.thank you smule,,,A Google user,others,others,generic evaluation,generic evaluation,,,1
41401431,9140,com.google.android.play.games,4,2016/9/23 0:00,Google play store,It's the best way to get games and explore games,,,Senan Banuka,others,others,generic evaluation,generic evaluation,,,1
32598421,1413,com.contextlogic.wish,4,2016/10/11 0:00,Most items well worth the average 3-4wks wait!,Love the prices & the selection. Excellent fast and user friendly interface. Paypal was extremely easy to set-up & use to safely pay for your purchases... Especially since they even gave me a line of credit. Paypal and Wish back all purchases. The shipping can take 3-4wks average. The clothes run extremely small (for ex: U.S. ladies XL I have to order either XXXXL OR XXXXXL. ******VERY IMPORTANT: READ THE CUSTOMER RATINGS BEFORE ORDERING,,,Anita Fuchs,others,others,generic evaluation,generic evaluation,,,1
62225898,2663,com.google.android.apps.maps,1,2017/8/17 0:00,,Google keep suggesting wrong place for where my current place. I used to contribute in edits but contributing experience become worse and worse,,,Arifin Bali,others,others,generic evaluation,generic evaluation,,,1
77338092,5830,com.sygic.aura,1,2017/12/17 0:00,,Search for addresses just doesnt work app restarts and is plainly unstable. (User support has been quite helpful pity the product is halfbacked). I bought premium licenses but rarely open/ use the app. For offline HERE is much better for traffic i go with waze and for user experience while on data Michelin... now i also tried to install car version and cannot even get it to start.,Hello Andrej the search is even easier than before to learn more please follow this article: https://goo.gl/E8x0Pc. Regarding the crashes please contact us at urgentsupport@sygic.com so we can sort it out. Thank you. Rudo customer care specialist,2017/12/18 0:00,Andrej Nosko,others,others,generic evaluation,generic evaluation,contact,,1
51803680,1331,com.cleanmaster.mguard,4,2017/1/21 0:00,,Very nice experience,,,Maranganti Pavankumar,others,others,generic evaluation,generic evaluation,,,1
26787192,2079,com.facebook.katana,3,2016/5/1 0:00,,Not as expected,,,Chrissie Hughes,others,others,generic evaluation,generic evaluation,,,1
42697949,10101,com.olacabs.customer,1,2016/10/7 0:00,I'm a victim of their latest scam,I used to be a regular ola user (36 times in 3 months) Their app pops up notifications that advertise offers (with no codes). If you touch them the offer disappears & app opens. I got a cashback offer (ironically in celebration of Mahatma Gandhi's birthday) and took a ride. But no cashback was credited. I emailed them. They ask proof for the offer. I was shocked. They cleverly designed volatile notifications to scam users. I'm uninstalling not for the petty cashback but for their **** values.,,,Gopinath Periyasamy,others,others,generic evaluation,generic evaluation,,,1
27783769,1908,com.ebay.mobile,1,2016/5/9 0:00,,This new fone app suxxxxx,,,Michael Bourne,others,others,generic evaluation,generic evaluation,,,1
61629561,2687,com.google.earth,4,2017/5/22 0:00,,Good app for exploring,,,A Google user,others,others,generic evaluation,generic evaluation,,,1
59648520,9189,com.microsoft.office.outlook,1,2017/4/25 0:00,,Nice ui but very unreliable phone email much better,,,Gabriel Rodriguez,others,others,generic evaluation,generic evaluation,,,1
83865490,5659,com.soundcloud.android,1,2018/3/25 0:00,,Graphic design is not good,,,plug4 real,others,others,generic evaluation,generic evaluation,,,1
66294030,6264,com.twitter.android,4,2017/7/30 0:00,Awesome,express your thought,,,Ashutosh Chand,others,others,generic evaluation,generic evaluation,,,1
72985754,6278,com.ubercab,1,2017/10/18 0:00,,When I was booking it always shows unexpected error.... I was irritated,,,balaji gopisetty,others,others,generic evaluation,generic evaluation,,,1
44646700,2681,com.google.android.music,1,2016/10/30 0:00,,Worst experience ,,,Nikhil Khandare,others,others,generic evaluation,generic evaluation,,,1
51087581,4844,com.pinterest,1,2017/1/12 0:00,Suspended Acct,No Comprehension between explicit and nice,,,mjholeshot,others,others,generic evaluation,generic evaluation,,,1
32649087,2012,com.estrongs.android.pop,3,2016/7/22 0:00,Excellente application.,Que ce soit pour les transferts r seaux local (S)FTP le Cloud ou encore un simple copier-coller cette application n'a jamais plant  et les performances sont bonnes. Vraiment rien  dire de n gatif sur cette application qui reste une des meilleures de celles que j'ai pu tester.,,,Yoann Fleury,others,others,generic evaluation,generic evaluation,,,1
66701949,2686,com.google.android.youtube,4,2017/8/3 0:00,,Continue improving the app for us to always have better experience on wathching videos,,,Jaimee Quintana,others,others,generic evaluation,generic evaluation,,,1
28151829,3175,com.instagram.android,1,2016/5/13 0:00,Updated,I have had Instagram for a very long time and the new update is ugly it's cheap and just not creative,,,Matilda Gonzales,others,others,generic evaluation,generic evaluation,,,1
74110592,9165,com.ksmobile.launcher,4,2017/11/3 0:00,,Pretty cool interface,,,Elvis Chadamoyo,others,others,generic evaluation,generic evaluation,,,1
77529818,9266,com.spotify.music,2,2017/12/20 0:00,,To expensive constant issues,,,Tyson The Rand,others,others,generic evaluation,generic evaluation,,,1
71957302,9165,com.ksmobile.launcher,4,2017/10/4 0:00,,Thank you overall experience is good. Twice automatically it was uninstalled to me.,,,vamsi krishna,others,others,generic evaluation,generic evaluation,,,1
64675330,2681,com.google.android.music,2,2017/7/4 0:00,,I don't know why the user experience doesn't feel good,,,A Google user,others,others,generic evaluation,generic evaluation,,,1
74629343,9189,com.microsoft.office.outlook,4,2017/11/10 0:00,,Nice easy to use interface,,,Jesus,others,others,generic evaluation,generic evaluation,,,1
40560740,1870,com.duolingo,4,2016/9/14 0:00,Hungarian,Great app! Well designed!,,,Darius Haskell,others,others,generic evaluation,generic evaluation,,,1
52069303,9266,com.spotify.music,2,2017/1/24 0:00,,Simply a horrible interface...,,,A Google user,others,others,generic evaluation,generic evaluation,,,1
73118883,9146,com.hola.launcher,4,2017/10/20 0:00,,Liked the interface,,,nanda kumar rajendran,others,others,generic evaluation,generic evaluation,,,1
34228069,10101,com.olacabs.customer,1,2016/7/11 0:00,Unreliable,Has so many options for cabs none of them seem to have any cabs at all. And when you most need it no cabs always. Horrible experience.,,,Sohab Saqib,others,others,generic evaluation,generic evaluation,,,1
36875688,2012,com.estrongs.android.pop,4,2016/8/5 0:00,Nice,Experience with this app is better,,,Alpesh Tilva,others,others,generic evaluation,generic evaluation,,,1
63313028,2012,com.estrongs.android.pop,4,2017/6/18 0:00,,The very useful and the best free file explorer I have used.!!!!,,,Dinesh Senids,others,others,generic evaluation,generic evaluation,,,1
40897887,8209,com.mxtech.videoplayer.ad,4,2016/9/18 0:00,Good,Would be better if it supports ac3 flv... UI is best,,,joseph manoj,others,others,generic evaluation,generic evaluation,,,1
29403913,9243,com.quvideo.xiaoying,4,2016/5/24 0:00,Great but..... ,It's Awsome great wonderfly designed but u now HAVE TO PAY FOR THE WATERS MARK I HATE THAT!!!!,,,Pup Gaming,others,others,generic evaluation,generic evaluation,,,1
43867674,8209,com.mxtech.videoplayer.ad,4,2016/10/21 0:00,Very nice one app,Volume increase and decreasing very useful to meet hall time I can't explain it but like you,,,bhuvana suresh,others,others,generic evaluation,generic evaluation,,,1
28278798,6573,com.whatsapp,4,2016/5/14 0:00,Superb apps,I will give 5 star when they release new design and theme for there app,,,diva 7509,others,others,generic evaluation,generic evaluation,,,1
40766558,6278,com.ubercab,1,2016/9/17 0:00,,Poor app interface and no customer support at all,,,Hossam Mostafa,others,others,generic evaluation,generic evaluation,,,1
26875007,3175,com.instagram.android,3,2016/5/1 0:00,Drives me nuts that you can't zoom!,Come on Instagram...I view all my Instagram through Flipboard. It's a better experience.,,,Dave Armstrong,others,others,generic evaluation,generic evaluation,,,1
32622883,9136,com.google.android.apps.photos,3,2016/6/24 0:00,,Nice aesthetic !,,,Vinod Balram Balkote,others,others,generic evaluation,generic evaluation,,,1
68425822,9189,com.microsoft.office.outlook,4,2017/8/22 0:00,,Great Interface,,,Sumit Madan,others,others,generic evaluation,generic evaluation,,,1
30355921,5594,com.snapchat.android,1,2016/6/3 0:00,,Not user friendly design,,,edwin satriawan,others,others,generic evaluation,generic evaluation,,,1
31417275,10177,com.reddit.frontpage,2,2016/6/13 0:00,,I hate that generic google interface,,,mayvot ultra,others,others,generic evaluation,generic evaluation,,,1
77245072,9266,com.spotify.music,4,2017/12/16 0:00,,Great app .. total life changing experience!,,,Solko Detmers,others,others,generic evaluation,generic evaluation,,,1
52245402,1413,com.contextlogic.wish,4,2017/1/25 0:00,,So far good experiences!!,,,Aquilla Brock,others,others,generic evaluation,generic evaluation,,,1
42019581,9059,com.bitstrips.imoji,4,2016/9/30 0:00,,Cool new way to express yourself,,,Charmaine Trice,others,others,generic evaluation,generic evaluation,,,1
34317730,4826,com.picsart.studio,4,2016/7/12 0:00,,Oh wow the guiding video is great  seems good  and i'm attracted towards your good application. Waiting for it to make me enjoy pics,,,Billiard Bully,others,others,generic evaluation,generic evaluation,,,1
82624498,2686,com.google.android.youtube,4,2018/3/6 0:00,,nt xo gud as expectatn,,,A Google user,others,others,generic evaluation,generic evaluation,,,1
51170980,2657,com.google.android.apps.docs,3,2017/1/14 0:00,It's OK,User interface could be better.,,,Aryan Adarsh Gautam,others,others,generic evaluation,generic evaluation,,,1
102324709,27774,com.intuit.quickbooks,1,2018/9/10,,This app takes forever to do anything. It literally takes a minute just to open after I tap the app icon. Completely useless. Information is not reflected correctly during use. Just use a web browser instead.,Hi Ryan  I want to make sure you can quickly and easily manage your QBO account on the go. If you don't see your current data it can help to open the app's Settings and tap Refresh App Data. To improve its speed please try this: 1) Open your S8's App Settings. 2) Tap QuickBooks. 3) Tap Storage then Clear Cache. -Kristian (QBCares@Intuit.com),2018/9/10,Ryan Hasse,interaction,interaction,feedback,feedback,advice,,1
102911690,29330,com.kinpoint.takeaname,3,2018/1/14,,A friend recommended this recently and I thought I give it a try but only a blank screen shows up on my Pixel 2 phone. It worked great for my friend. The app seems not to be compatible with my phone. :(,Ruth The Pixel 2 startup problem is fixed! Grab the latest version from Google Play (1.0.16) and it should work properly. Let us know if you see any remaining issues. Thanks!,2018/1/17,Ruth Mathusek,experience,experience,feedback,feedback,unspecify,,1
113501881,56534,dsgui.android,1,2016/4/4,Black screen for a months! Now April and still won't load.,Open app and black screen is all I get. Cleared cache Un install reinstall. If I wanted a black screen I'll turn my phone off. Not working since before December.,We are very sorry that you are experiencing a black screen. We have reported the issue. We hope to see a resolution soon!,2015/12/9,Nick Cook,experience,experience,feedback,feedback,apology or appreciation,,1
112858229,55058,com.pextor.batterychargeralarm,4,2018/6/16,,I've been using this for years but now there's a bug that don't let my screen to automatically shut off. Every time the alarm goes off I have to manually turn the screen off or I'll wake up low battery with a smoking hot phone.,Hello if you have any problem please contact me via email to solve the problem. developerpextor@gmail.com. Please check out our support page. Thank you for your feedback.. https://www.fullbatterytheftalarm.com/support,2018/6/19,Nostradamus Alchemi,experience,experience,feedback,feedback,inform,,1
103382932,30385,com.livechat.dating,1,2017/9/27,,I downloaded it and comes yo in red live char in a red screen and then its blank it don't work what a heap of rubbish don't waste ya time,Thanks for your feedback. Why do not u like this free dating app?,2017/10/14,A Google user,experience,experience,feedback,feedback,unspecify,,1
114732203,57566,cz.cfc.androidgp.sightwordslite,1,2014/12/27,,There was no graphics I had a blank screen and only sound,The current version should work fine also on your device.,2015/1/29,Laura Hill,experience,experience,feedback,feedback,inform,,1
