REVIEW_ID,APP_ID,PACKAGE_NAME,RATING,REVIEW_DATE,REVIEW_TITLE,REVIEW_TEXT,REPLY_TEXT,REPLY_DATE,REVIEWER_NAME,CATEGORY,PRIMARY_CATEGORY,SUBCATEGORY,PRIMARY_SUBCATEGORY,REPLY,HANDLED,IS_FREE
110223386,48072,me.klooz.dominik.floatingbrightnesscontrol,2,2018/3/20,,Excellent idea. However doesn't works well in locked landscape screen rotation. Also can't find a singe spot on the screen for this feature I use all the screen meaning I accidentally hits the trigger and scroll a lot. Perhaps a finger gesture trigger would be preferable for me.,Thank you for your feedback. I would love to improve the app could you please contact me (dominik.klooz@gmail.com) with more information about what exactly doesn't work as expected in landscape mode if it's not too much trouble? About the gesture trigger have you tried using the trigger instead of the standard bar? Don't hesitate to contact me!,2018/3/21,Ragnar Ekre,interaction,interaction,navigation,navigation,information request,,0
99235334,20180,com.dailyroads.v.pro,5,2017/8/19,,Very useful. Can record video with screen off. Still can't figure out how to switch the camera and record from front camera.,Switching the camera is not yet possible but we plan to support this in a future version.,2017/8/20,Nomina sunt Odioza,interaction,interaction,navigation,navigation,justify,,0
100468557,23362,com.forcereadiness.armypromote,2,2016/6/8,Almost useful,My GT score is 126 im a smart dude and I dont think this is a good study guide. Theres no difference between this and just reading out of an adp. How is a three paragraph answer going to be on a flash card. Its like reading from a chopped up TM. I might just take whats useful from the overwhelming amount of fluff and copy it on index cards for useable flashcards. Also you cant save the categories of questions you want so if your MOI has a mix of things each time you have to hunt with your MOI close by.,Hey smart dude there is a BIG difference between this and reading out of an ADP. We're surprised you would write that. We took the main points out. We track your study and test progress. We will probably add the MOI capability though. Many requests for it.,2016/7/16,Josh C.,interaction,interaction,navigation,navigation,justify,,0
109595105,46285,fi.bugbyte.harbinger,5,2017/5/16,,Its glitching out on me... Every time I start a new game I'm not given an opinion to use any equipment or weapons post an email address and ill send you a screen shot,Hi! When you start a new game you have to wait for the scrap to be collected about 5 seconds. Then you have around 1000 scrap to buy. Click the engineering button and then click on a slot to see options. If it is not working you can contact us at support@bugbyte.fi,2017/2/7,Chris Van Kralingen,interaction,interaction,navigation,navigation,advice,,0
103896706,31713,com.mightypocket.grocery.full,1,2014/12/18,Latest update is rubbish,Don't like that I have to find the checkout in the menu instead of on the main screen the list of lists is cluttered and just shows everything 3 times the widget has been designed by a 3 year old. Can I please have the old version back that was a great app now you've ruined it!,Thank you for your feedback. This link provides a few Usability Tips which should help adopt the new version: http://goo.gl/OAJwV9,2014/12/29,Uschi Mahaffey,interaction,interaction,navigation,navigation,justify,,0
104137887,32291,com.modernpenandpaper.a21daycompletereboot,4,2016/7/19,Not bad,Wish the app looked a little more user friendly thats appealing to the eys and easy to select items... also when selecting container food wish they were in alphabetical order.,Hi K Tom thank you for the review. The food lists are in order of nutritional value per the Get Lean/Eating Plan book. You can use the search feature to easily find and add meal items. Please email me with any other questions/suggestions. Email address in Guidance section. Thank you - Tony,2016/7/19,K Tom,interaction,interaction,navigation,navigation,advice,,0
101766214,26320,com.herocraft.game.tinybangstory,1,2013/10/11,Not Working on Galaxy Note 3,I purchased yesterday and it is stuck on intro screen. Music plays but will not advance passed intro screen.,Dear Vince this game doesn't support FHD resolution. We apologise for this issue. Please contact our support team on support@herocraft.com to get refund.,2013/11/20,Vince R Mojica,interaction,interaction,navigation,navigation,information request,,0
105917484,36815,com.rascarlo.quick.settings.tiles,3,2016/12/13,Some functions don't work,Voice didn't work and also search blended in with screen and couldn't make out screen,Thanks for your feedback. Please if you care contact me and we can troubleshoot your issues.,2016/12/13,Brian Miller,interaction,interaction,navigation,navigation,information request,,0
101857499,26602,com.hookah.gardroid,5,2016/5/25,It's awesome,It's awesome. Had an issue with it once but whatever it was it's working fine now. Great app. Has plenty of great info on most plants. Great for beginners and planning your garden. A must have if guidance or reference. Definitely worth every penny. Thanks for making this.,Hi there I'm sorry to hear that there is a problem with the vegetables that are not loading. Can you please contact me via email so I can help you out further? Thanks in advance!,2016/5/25,vernon linnabary iii,interaction,interaction,navigation,navigation,information request,,0
98605557,18485,com.cepher.cepherapp,3,2017/7/22,,Love reading the scriptures from this app...just don't know how to remove bookmarks or even where to find the info....also I would love to be able to label my color coded footnotes. Wonderful app!! thanks.,We might look into the labeling of color codes in the next upgrade. To remove the bookmarks drag you finger to the left on the desired bookmark you want to delete and tap the word delete in red and your bookmark will be deleted.,2017/7/26,mamasita singh,interaction,interaction,navigation,navigation,advice,,0
99558317,21047,com.dna.lyricpad2.full,4,2013/5/24,Very useful once it's set up.,Nice app. I'm looking forward to my first gig. This has been great for practice. It would be nice if you could search Ultimate Guitar or Chorus to get chords with the lyrics.,This feature is being worked on currently :),2013/5/25,Michael Miller,interaction,interaction,navigation,navigation,promise,,0
97985663,16930,com.bigbeard.echovox,5,2015/2/8,Help For A Newcomer!,I'm new to this app (bought it a last week) and could sure use some guidance from all you pros. I did have an odd session the other day: my cockatoo was fussing in her cage and I hollared Angel!! to shut her up. A few seconds later a woman's voice  pet  then a man's voice  bird . I laughed then another voice  laugh. Wish we could contact one other for assistance. You have a great deal to teach us newcomers ;-) I pick up 7-8 voices at any given time and don't know how to fine tune them!,Come join us here: www.facebook.com/groups/echovoxusers,2015/2/8,Mary Stanley,interaction,interaction,navigation,navigation,apology or appreciation,,0
107172012,39935,com.stefsoftware.android.photographerscompanionpro,5,2018/5/1,,At a first glance it needs more guide numbers for flashes. My flash is a 58.,No problem I'll increase that in the next version.,2018/5/2,Cristi Neagu,interaction,interaction,navigation,navigation,promise,,0
114653308,57390,com.ss.popupWidget,5,2013/5/6,Utterly brilliant,I love a minimalist home screen setup so this app lets me keep things that way while still giving me quick access to useful widgets. Being able to launch as a shortcut is great and the problem with UCCW was quickly fixed. Thanks,Fixed this issue. Reassign the hotspots.,2013/5/6,A Google user,interaction,interaction,navigation,navigation,inform,,0
106638042,38587,com.sigames.fmm2018,4,2018/7/1,,For some reason on OnePlus 6 the alignment of the screen isnt quite right. Selecting players and navigating around the game I have to aim a few mm to the left of the actual item I want to select. Very annoying would appreciate a fix,Hi Huw sorry for the slow reply we are aware of this and are still working on a fix I'm sorry it has taken a while,2018/9/27,Huw Whyment,interaction,interaction,navigation,navigation,apology or appreciation,,0
100540632,23616,com.franco.kernel,5,2018/9/8,,It would be nice to have a guide that explains every options in it.,Hi Joel. That's planned. Thanks for the feedback.,2018/9/8,joel alexander john,interaction,interaction,navigation,navigation,apology or appreciation,,0
105200516,35025,com.pecana.iptvextremepro,5,2017/8/5,,I don't usually leave reviews but this is the best layout of an iptv app I've ever seen. Much better than perfect player and a lot better than stb emulator. Highly recommend it. If I could make one suggestion I'd say on the epg could you fit two programmes on instead of one when in landscape mode? This would allow us to see what's on next without navigating the menus. Other than that fantastic!,Hello and thank you ! I will try to add it :-),2017/8/5,Jamie Robinson,interaction,interaction,navigation,navigation,promise,,0
103455911,30598,com.loxai.trinus.full,2,2015/3/26,I tried.,I really tried everything but it's complicated I couldn't even found the server in my pc. The screen where you see all the settings. Same in my note 4 .I paid for full version and watched all videos to learn but I give up.,I'm working on making it easier. Please use the forum or contact support for assistance.,2017/8/25,pedro torres,interaction,interaction,navigation,navigation,apology or appreciation/information request,,0
97633958,16004,com.atos.ver,4,2014/6/12,Spelling mistakes!,Hey devs is English your native language? Because there are a few spelling mistakes I've noticed in the first few minutes of playing your game; On the character selection screen it says 'food eaton' instead of food 'eaten' and in part of the gui it says 'equipt' instead of 'equipped'.,Hiya Fred thank-you for the heads up on the spelling mistakes. English is our first language but these spelling mistakes just keep popping up. We really appreciate the feedback thanks! Have a good day.,2014/6/12,Fred Nicolson,interaction,interaction,navigation,navigation,apology or appreciation,,0
107313748,40309,com.superphotofull,2,2015/12/23,Filters don't work for me.,Every single filter I select it says error generating input image.,Hello Jason what gallery are you using? What photos are you using? Please contact us by email to investigate the issue and fix the problems thanks. Moonlighting Apps.,2015/12/24,Jason S,interaction,interaction,navigation,navigation,information request,,0
108513922,43352,com.vicman.photolabpro,2,2018/6/22,,No way to comprehensively search photos on device. Frustrating...,Dear user thank you for the review it is much appreciated. We are constantly working on improving Photo Lab and your feedback really helps us.,2018/6/25,P Sanchez,interaction,interaction,navigation,navigation,promise,,0
106897834,39270,com.sogniinc.a21daysimple,4,2016/4/22,,Love this app user friendly and has all the info needed to not get lost with the 21 day fix. I only wish food list was in alphabetical order and also that there was an option to put down my what I ate along with selection of the meal containers. Over great app!,Hi Mariana thank you for the review! According to the Get Lean/Eating Plan book the food lists are in a specific order - order of highest nutrition. It is suggested to select the top items over the bottom. Please email me with any questions. Email address in Guidance section. Thank you - Tony,2016/4/22,Mariana Paiz,interaction,interaction,navigation,navigation,advice,,0
103842686,31591,com.metamoji.noteanytime2,2,2014/10/5,okay,Too hard to find how to change pen color. Still havent find it.,Please tap the pen icon on the top bar. You will have the list of five colors. Then choose a color and tap the color again. You will have the Color Palette. For more question please contact support_anytime@metamoji.com. - Support team MetaMoJi,2014/10/6,Cooper,interaction,interaction,navigation,navigation,advice,,0
101877179,26655,com.hornetapps.blackjacktrainer,5,2013/9/19,Best Droid BJ Trainer I Know,First let me praise the customer support for this product. I wrote Dominik asking for a way to reset the statistics and a week later the product was updated with that feature! Other than a few quirks the user interface is very smooth. An example of what I call a quirk: to get to Settings you have to go back to the main menu...the usual (Android-standard) settings button at the bottom of the phone does nothing. Also--and this is NOT a criticism--you should know there is no option to play out the hand. You get to choose a play on the deal; that's all. But this is a trainer not a game so I think that is perfectly okay. I highly recommend this app for learning the basic Blackjack strategy (i.e. without card counting). If the built-in rules for the standard basic strategy don't suit you you can modify them.,Hello Greg the latest version of BlackJack Trainer Pro allows you to reset statistics! Thanks for your feedback!,2013/9/3,Greg Young,interaction,interaction,navigation,navigation,unspecify,让用户升级,0
123772874,50373,pitchblack.samsung.substratum,3,2018/11/29,,how do I change notification sounds and add pictures to email or like I tried putting an item on eBay for sale but like when I try changing sounds when I try to look up my picture to post on eBay it crashes. if you can help me with this is give 5 starts I love everything about it other than those 2 problems. r thanks for the hard work it's almost paid off in my opinion,Some of your apps is probably updated. you should reapply . Thanks,2018/12/1,barron CASH,appearance/interaction,interaction,image/notification,notification,,,0
112907268,55203,com.wiseschematics.reeq01,5,2018/4/26,,Equalizer is ok but i don't want to see the interface of reeq when i plug my earphone's jack to the phone. Every time! It's too annoying. Reeq please work in background quietly.,Hi  Thanks for the feedback. Your suggestion has been forwarded to our support.,2018/4/26,Merter Balc ,interaction,interaction,notification,notification,apology or appreciation,,0
103185886,29957,com.ledblinker.pro,5,2016/2/9,The only LED notification app that works correctly with my BlackBerry Hub on my G4.,I have tried the other popular LED notification apps and couldn't configure them correctly to work with my BlackBerry Hub so I was glad to find this one. I do wish there were alternating color options and the ability to have different contact colors for SMS as well as missed calls. The other thing I would like to see is a wifi connection option. My wifi disconnects at work all the time and it would be helpful to have an LED notification to let me know I need to reconnect.,Hello wifi connection is planned for future updates so you want wifi connected notification and NOT wifi is on notification only? Regards,2016/2/10,A Google user,interaction,interaction,notification,notification,promise,,0
103184602,29957,com.ledblinker.pro,4,2016/6/15,Bummer about Samsung,I have a Note 5 and wish that there wasn't that workaround... That being said I'm using Light Manager Pro right now only because this app (LED Manager) does not have the ability to wake the screen or select when the LED lights turn on. The reason I want the wake screen feature is because it's a band-aid for the blue LED issue. If those were implemented into this app I'd return to it. Neither app turns off with Do Not Disturb on for some reason. But that would also be a game changer.,Hello you have to disable the option for do not disturb mode. If you want screen wake up use on screen led with a short timeout. Regards,2016/6/15,Jon Kison,interaction,interaction,notification,notification,advice,,0
102576675,28486,com.john.xmessengerprivacypremium,3,2017/3/19,,Works but a little buggy. When I use the option to not show when you've seen messages it just keeps the messages notification even if Iark the whole conversation as seen. I end up having to turn off the option and turn it back on for the app icon to stop showing the number of unread messages.,Hello to mark a conversation as seen you'll have to open it then double click on a message. A toast showing Seen message should come up. That way you'll no longer have unread messages.,2017/3/19,Joel Arce,interaction,interaction,notification,notification,advice,,0
109269227,45249,com.zoiperpremium.android.app,4,2017/4/11,,Hi developer thank you for all the replies 2 questions. I have just got an LG G6 running Android 7 and I am finding that the little notification green tick top left hand corner stays on in green even when there is no mobile connectivity or on airplane mode. This notification icon used to just go off when there was no network. Please help. Cheers :),The notifications are being reworked please try the last beta to see how it works for you. https://play.google.com/store/apps/details?id=com.zoiper.android.zoiperbeta.app&hl=en,2017/4/13,Okay Google,interaction,interaction,notification,notification,inform,,0
103185183,29957,com.ledblinker.pro,4,2015/12/20,,Works for me well both on phone with LED (Nexus 5) as well as on one without it (by displaying notification on the screen). The second option has too much negative impact on battery life however although I think the application should not be blamed for it. I take one star for cluttered interface but otherwise this application is a tool I love to have.,Hello thank you for your honestly rating. Regards and Merry Christmas!,2015/12/21,Pawe Bulwan,interaction,interaction,notification,notification,apology or appreciation,,0
110754180,49589,org.cdesolutions.acimworkbookwithreminders,5,2016/3/21,Alerts worked first time / day but not anymore,Easy to use but the alerts don't work. Any updates coming soon? Thank you.,Please update to the most recent version and follow important note in Help to correct alerting issues.,2018/4/4,hsimg7,interaction,interaction,notification,notification,inform,,0
102106546,27171,com.iglint.android.screenlockpro,3,2015/10/13,Bugs,I only use the notification access to lock the screen but I'd say 20% of the time the notification access won't appear unless I go to the settings and switch notification access off and then on again. Annoying as it is an intermittent problem. Galaxy s4,Please confirm that Screen security  Lock screen  Screen lock  is not set to None . ,2015/10/13,ameer aboud,interaction,interaction,notification,notification,advice,,0
193872,109980849,jp.co.korg.kaossilator.android,4,2016/12/2 0:00,Finally!,I've waited a long time for one of the mainstream music companies to release something on Android. Good: you can set different lengths for the tracks; lots of sounds; you can turn off those corner lights; easy to start working with. Con: saving importing undo is not intuitive and leads to a roadblock after the initial WOW of music-making; too many sound options leads to lots of scrolling to find a good sound.,,,justin johnson,interaction,interaction,notification,notification,,默认问题,0
103510086,30725,com.lwi.android.flappsauto,2,2018/7/22,,This app is useless. I appreciate the time that the developers put into it  but this is still far from good and useful. I bought it because I wanted to use google maps on my car screen but many features are not available and the navigation metgod in this version of google maps is not usef friendly at all. The software is slow and crashes often. I want my money back!,Hi thanks for your report. The app is constantly being developed and improved some things are difficult to bring to perfection. Please contact us via car.mirror.link@gmail.com - we will help you with setting up!,2018/7/22,Valentin Torma,experience,experience,redundancy,redundancy,apology or appreciation/information request,bloated ,0
97092025,14187,com.alarmclock.xtreme,3,2018/10/14,,I don't like the new ui update. Text is too small for the alarm. Can't customize the colors or background. 'day' screen is useless. I've used this for years now I might need to look elsewhere..... Very very frustrated. Will raise rating from 3 back to 5 if they put stuff back to the way it was or fix a few things I've pointed out in email that make it less useful to me. I guess removing customization and features and making things smaller /harder to read is improving things.,Hi Matthew the new version is bringing not only a new design but many improtant fixes so we are not planning to return to the old version. But your comment will be forwarded to the developers and we are also working on new features and bugfixes. Tereza*AVG EDIT - Thanks for updating your feedback we keep working on improvements!,2018/10/23,Matthew Stevenson,experience/appearance,experience,redundancy/customization limitation/typography,redundancy,inform,unnecessary,0
101049442,24538,com.gau.go.launcherex.key,1,2015/3/10,Stupid update,Have had prime for quite some time and today I woke up to a different theme and my app drawer was screwed up. While I was searching for my old theme I suddenly found myself looking the default new install screen. That's pretty crappy. I now have to waste time setting everything back up... Folders settings gestures etc. That sucks. May not keep now.,Hi Sean Watts Your feedback already record.We will checking the problem you've mentioned and will fix it later. Best Regards ,2015/3/11,Sean Watts,experience,experience,redundancy,redundancy,promise,,0
192220,109813183,imoblife.toolbox.full.prokey,2,2017/11/11 0:00,,The key and the app aren't matching up for me! I've bought it twice now. Using galaxy s7 Tmo US variant. (G930T) the Qualcomm with the locked bootloader. It's stock and running whatever T mobiles latest OTA baseband is. Play Store is not modded. WHYY? EDITED: I hadn't realized that I had used 2 different Alphabet/Google/gmail accounts (I guess) in order to download one and then the other  causing my chagrin. NO fault of the apps Devs.  So far this is very useful  in the vein of 3C Toolbox and the ES suite of app. M .. Perhaps better...  That is yet to be seen,Dear user thank you for your kind support. We will work to make the app better. Contact support@aiotoolbox.com if you meet any issue we are always ready to help. Thank you.,2017/11/15 0:00,Frank Peluso IV,experience,experience,redundancy,redundancy,,unnecessary,0
20323,97266803,com.androidputing.crossword.puzzle,2,2015/3/30 0:00,Unresponsive!,When I tap my screen to highlight a new blank space when trying to start on a new clue the highlight won't respond even after repeated taps on the screen. Very disappointed! :( uninstalling.,,,Christine Kovic,experience,experience,redundancy,redundancy,,unnecessary,0
24670,97549196,com.asa2fly.faraimandroid,3,2015/9/13 0:00,Good; needs some changes,Needs to be easy to move from one section to another without backing up. I suggest left or right swiping. Also the display font needs to be resizeable via pinch-zoom.,,,Dean Gibson,experience,experience,redundancy,redundancy,,bloated,0
100717,103506740,com.lyrebirdstudio.colorsplasheffect.pro,3,2016/10/25 0:00,Does lots,Can do much more than colour splash worth installing and having a look since last updated can't find library or some of my previous favourite PIP templates,,,Ian Flukie,experience,experience,redundancy,redundancy,,unnecessary,0
71124,101051361,com.gau.go.launcherex.key,1,2015/6/23 0:00,,GO Launcher used to be a versatile customizable fun launcher to use. Now it is packed to the brim with bloat with the developers trying everything invasively possible to force their in-app purchases and family of other bloated apps down your throat. Also most of the customization options have been done away with in recent versions seemly in effort to again force you to pay for themes from their store. With so many other beautiful lightweight truly customizable launchers out there this one has become just an eyesore. I used this launcher for years and have finally defected because of a lack of consideration for their user experience design standards and community.,,,Jay S,experience,experience,redundancy,redundancy,,,0
101167216,24874,com.gingersoftware.android.page,4,2017/3/25,,Ginger Page very useful.  Love the rephrasing helped me a great deal. I truly hope you can help by added to the setting that gives the option's ability such as fonts size alteration to the darker theme background. The second matter is that by using other keyboards the rephrasing is hard to see not like using ginger keyboard text is a white and dark background.,Ginger is intended as a writing pad where writers can write their text and perfect their English through grammar correction and rephrase. After it is perfected inside Ginger Page the text can be easily pasted or shared into other apps in order to properly format it and so on. We will look into the background issues. Thank you for your feedback.,2016/7/28,Susi Q,appearance,appearance,typography/color,typography,advice,,0
