REVIEW_ID,APP_ID,PACKAGE_NAME,RATING,REVIEW_DATE,REVIEW_TITLE,REVIEW_TEXT,REPLY_TEXT,REPLY_DATE,REVIEWER_NAME,CATEGORY,PRIMARY_CATEGORY,SUBCATEGORY,PRIMARY_SUBCATEGORY,REPLY,HANDLED,IS_FREE
63142,100250408,com.fantasyflightgames.swdice,2,2018/8/24 0:00,,....Still works after update and rolls dice well. My presets are gone and work way different now. The app loads much slower compared to older version. You can't use the back button. You'd think they would add something useful for an update like color your success/failure result differently so you can easily visualize outcome of roll.,,,A Google user,experience,experience,accessibility,accessibility,,,0
125068,105356362,com.pikpok.kik,1,2015/4/8 0:00,Deserve a refund,When I Bought it I had my first an and I couldn't even get past the start the menu was bugged and couldn't swipe to play I couldn't do any game mode cos I couldn't choose play on the start screen!! Please fix!!,,,Mitchell Roe,experience,experience,accessibility,accessibility,,,0
109847094,47053,info.wobamedia.mytalkingpet.plus,1,2018/8/28,,Ever since I installed thisapp...I have been getting pop up ads on my homescreen..not sure if it is these guys or not but they are The only change.pleaseadvise.i am going nuts with ads every minute. Ugb!!,Hi Sherry we don't use any advertising at all in the app so the adverts on your homescreen are definitely not coming from us. It may be best to contact your phone manufacturer's support line to try and resolve the issue. Good luck and we hope you find a solution.,2018/8/29,Sherry Sabety,experience,experience,advertisement,advertisement,explanation,一些误会,0
103530348,30766,com.madapps.madcontacts,2,2015/10/15,,Paid for full version but still get ads every time I use it and other features like changing colour still aren't working.,Edit: please contact me if it doesn't work! Hi Joanne the paid version is a seperate app. You need to uninstall the free version (in settings/apps) and add a widget of the paid version. I can assure you the paid version has no ads and all the colors are unlocked. Please reach me at madapps4android@gmail.com if you have questions or problems. ,2015/10/19,A Google user,experience,experience,advertisement,advertisement,justify/advice,,0
107056888,39627,com.speedsoftware.rootexplorer,1,2016/5/7,Love the new UI,The new interface is amazing now we just need to lose the icon... it's hideous. Why did you enable advertising on my paid copy of this app... fix this soon please.,You shouldn't be seeing ads. Please email us (support@speedsoftware.co.uk) and we will look inot this for you. Thanks,2016/5/13,Tim M,experience,experience,advertisement,advertisement,justify,,0
109652714,46423,fr.nghs.android.paid.dictionnaires,5,2014/7/8,best dictionary app.,I love how quickly the app loads the ui is superb and being able to select the dictionary source is nice the fact that it's offline is the best feature of course. definitely worth the money to get rid of ads.,Thank you very much for your feedback Dan!,2015/11/4,Dan Worth,experience,experience,advertisement,advertisement,apology or appreciation,,0
103249678,30109,com.lge.theme.markbencze.pixel.experience.dark,5,2018/9/22,,Sure does as advertised; a dark theme. Couldn't be happier thanks for awesome work!,Thanks a lot Per,2018/9/22,Per Johansson,experience,experience,advertisement,advertisement,apology or appreciation,,0
96385213,11892,bitsykolayers.piereligio.dst,5,2017/9/13,,Nice colors well polished. All the apps I use are themed. Only problem: the check update status section is written white on white. Nexus 5X stock Oreo.,Thanks :) Yeah I'll fix that,2017/9/13,A Google user,appearance,appearance,color,color,promise,,0
109449848,45777,de.program_co.benclockradioplusplus,4,2018/10/11,,Purchased this after using the free app. Like the extra features but can't see a way of adding a sound file to use if there is no internet available. Also my numbers colour on clock is always white and I would like green as an option. As per reply ... this morning the alarm didn't go off as broadband wasn't working and there was no backup alarm sound. Also it makes no difference if I select red or blue I still get white as an alarm clock colour (although the icons are red or blue),Hello  there is a sound file integrated into the app which will be played as fallback file when no internet available. Currently you may select a blue on black or red on black color scheme for the wake-up screen no green sorry. Ben,2018/10/11,Mike Pursey,interaction/appearance,appearance,notification/color,color,justify/advice,,0
110288542,48218,minar.wmwatch.pipboy,4,2015/8/30,Time type can be overridden. Need its own app.,Watch time can be changed from watchmakers settings by forcing override. Hopefully this will see its own application someday because its way too cool to have to rely on watchmaker. If it had its own app things like color and widgets could be turned on and off at will without worry of having the face stolen and having those options being pushed to the watchface from an app would solve battery issues. Please devs!,I'm working on a standalone version but it's way more difficult to do it! i'll need a lot of time! in the meantime update out ;),2015/8/31,Deer Deity,experience/appearance,appearance,customization limitation/color,color,promise,,0
111589335,52109,net.newsoftwares.folderlockpro,2,2015/2/22,,When I view my pictures in the app they are quite darker than they are in my gallery before they're imported. Why is this happening and can it be fixed?,Sorry for inconvenience this issue is only with certain devices but our development team is working on this feature and will resolve this issue in future version. Thanks for your feedback NewSoftwares.net team.,2015/2/23,A Google user,appearance,appearance,color,color,apology or appreciation,,0
104775107,33899,com.nostalgiaemulators.gbcfull,2,2015/3/25,I love this app but!,I purchased this app I have lots of games downloaded for it but half the Games that I have are still in black and white and some in color what's with that ? Can somebody help? Galaxy Tab 3.........,GB games are in black and white GBC games are in color...,2015/4/1,SEVARG HEADCRACK,appearance,appearance,color,color,justify,,0
97288761,14841,com.aneeshpradeep.amoledwallpaperspro,5,2017/5/4,,Great App. Got a handful of beautiful wallpapers with pure black tones to take advantage of the S8 + Super Amoled screen  5 Stars!,Thank you very much for your feedback  Please share and support the AMOLED Wallpapers application,2017/5/9,jamie carter,appearance,appearance,color,color,apology or appreciation,,0
111994570,53016,com.JohnWright.ThriveIsland,3,2015/8/25,,Night mode is way to dark. How can you play if you can't see anything?,This should be better for you now in todays update.,2015/7/2,travis klocek,appearance,appearance,color,color,inform,,0
108676789,43795,com.watch.richface.dynamic,4,2015/10/1,,Just updated my rating. I still would like a little color in Full Ambient Mode,Hi Tariq  just go to configuration app and enable Full ambient mode. Regards,2015/10/1,TariqNJFitness,appearance,appearance,color,color,advice,,0
99254932,20256,com.datscharf.beadstudio,5,2014/6/26,GASP!,Finally an app that beat '' beadit!'' this is amazing it goes beyond the 120 something pegs that beadit! Offers. Plus the color combo is awesome A+ on this. I would like to see where one pegboard ends and the other begins.,Thanks for the rating! I am a bit unsure what you mean about I would like to see where one pegboard ends and the other begins. if you could send me an email elaborating your idea I will do my best to improve the app! Best regards Martin,2015/3/21,Alvaro Vega,appearance,appearance,color,color,promise,,0
99031899,19576,com.corecoders.skitracks,4,2015/12/31,One flaw,On the Blackberry Priv some pictures are just a red blank and others work. Would love to see speed at different parts of a run.,Hi Alan please contact us at skitracks-android@corecoders.zendesk.com and we will do our best to help. Also could you please post your feature request at the following link. Thanks. https://corecoders.zendesk.com/hc/en-gb/community/topics/200387562-Feature-Requests,2016/1/4,Alan Castell,appearance,appearance,color,color,apology or appreciation,,0
111326752,51287,substratum.piereligio.bst,5,2018/3/12,,All the apps theme great. It's a great jet black color to the apps and settings. 1 of my go to apps with substratum. Developer I also very responsive.,Thanks a lot for updating the review :),2018/3/12,A Google user,appearance,appearance,color,color,apology or appreciation,,0
99392962,20718,com.digibites.calendarplus,5,2016/7/31,Continues as the best made App,I loved this app when I first installed it and this latest paid-for version is simply fantastic.      ** I now use it on my LG Tablet and my Samsung S5 and it's still fabulous. The connections with my various Outlook exchanges (personal and work)  Hotmails and Gmail is so efficient and accurate it easily surpasses anything that the multibillion-dollar companies could put out there.  (comment updated 7/31/16) ***  Its colors choices and content combine to make the only Android app that delivers everything that I envisioned when I went hunting for a calendar. I wanted a home screen that gives me a view of my entire month with enough detail to keep me on track for the day and for the week. The addition of the weather makes the front page just so pretty.,Thank you Susan for your very detailed review we're glad to hear you like it!,2016/8/1,Susan Ryan,appearance,appearance,color,color,apology or appreciation,,0
96391659,11919,bitsykolayers.piereligio.mdm,4,2017/4/30,,Works nearly perfect on DU 7.1.2 just one problem is that Spotify under Dark Notification theme looks very uncomfortable.. white text with black music controls..fix plz!,Oh. Weird I'll check that out. What Spotify version do you have?,2017/4/30,Ethan Levy,appearance,appearance,color,color,information request,,0
98925371,19287,com.coloursspeak,4,2017/4/22,,This app is cool. I didn't know there are so many colors!! and they all have names ,Thanks,2017/4/24,prashant pawar,appearance,appearance,color,color,apology or appreciation,,0
111412749,51600,uk.co.aifactory.go,3,2017/2/25,,Serious scoring bugs. The app uses the score estimator as the final scoring tool. If the final territory is large the score estimator will omit a few points of territory. This often leads to the computer missing out on a few points. Also the estimator/final score does not handle some seki correctly. If one color completely surrounds another then the inner group is considered dead even though it's seki. Finally the AI plays very poorly when lossing. It will not resign so you have to finish a nonsensical game to the very end or abandon the match.,Thank you the report. We will introduce a much more accurate scoring system in an update in the near future. If the cpu believes it cannot win it may make poor moves as all moves lose. This is a property of MTCS which AlphaGo also uses and causes AlphaGo to play bad moves when losing. We will consider adding cpu resign.,2017/2/27,lain galion,appearance,appearance,color,color,justify,,0
102436983,28069,com.jakyl.whaletrail,5,2013/2/9,Fixed! Thanks Dev!,Thanks for fixing the problem with Jellybean! No riots in the sky just a riot of colors!,Could you please update to version 1.3.2 and let us know if that fixes the problem? Thanks!,2013/2/8,A Google user,appearance,appearance,color,color,inform,,0
101831042,26527,com.hitcents.stickmanepic,4,2017/3/24,,Pretty good. But maybe a little more color might make it better.,Hello! Thanks for the suggestion. We'll take this into consideration.,2017/3/27,A Google user,appearance,appearance,color,color,promise,,0
106349251,37878,com.saites.spotlight,3,2017/12/16,,It's now detecting music fine. Seems there's a small amount of latency. Maybe that's unpreventable. The only problem I have now is the color when set to Static is only red. When I attempt to change it the setting automatically goes back to red.,After a confused bug hunt I have fixed this in version 2.1.5. The problem was actually not in the code but in a step that only affects release builds. You can read more about it here if you're interested: https://github.com/saites/music-blitz/issues/24.,2017/12/27,Joshua Dalman,appearance,appearance,color,color,advice,,0
98297626,17750,com.brit.swiftdark.substratum,2,2017/7/11,,My status bar went full dark ... Even those labels below the quick toggles are gone dark .. I'm not able see anything .. In my quicktoggles,Hi Satish. It will work I have the S8 myself. Are you using any other Samsung theme together with my theme? Please email swiftuserhelp@gmail.com and I'll help you set it up,2017/7/11,satish kumar R,appearance,appearance,color,color,information request,,0
111137991,50751,ru.infteh.organizer.full,4,2014/2/22,Good applications,Shud allow colour code for different groups of appointments.  And time sheet like page,To color different groups of events or tasks you should use different calendars and task lists. Add calendars and task lists in http://www.google.com/calendar assign colors to your calendars and these colors will be syncronized with our app. About time sheet - we are working on new views right now: text month view and day view.,2014/2/24,A Google user,appearance,appearance,color,color,advice/information request,,0
97855002,16559,com.bdc.nh,3,2013/11/22,Good game but ui bugs,On Nexus 5: armies (like NeoJungle and Vegas) tiles have a render bug: they are sometimes blinking or only drawn with a simple solid color. Images are not fully prepared for full hd screens.,Pls update to 2.14,2013/12/5,Mate Gregor,appearance,appearance,color,color,inform,,0
110814088,49790,org.koxx.pure_grid_calendar,5,2014/4/28,Developer responds to comments.,I've tried others but this is one of the better ones. Coloring of Google Calendar was very useful.  Only negative I can find is data separator cannot be a newline character.,This is not what I said. The calendar colors are fully used. The widget doesn't currently support INDIVIDUAL event color. Last thing Google Play ALWAYS offer a 15 minutes trial for ALL paid apps.,2013/10/10,Chris Chaulk,appearance,appearance,color,color,justify,,0
96610825,12539,com.AaronBernstein.ltctimecodegeneratorpro,1,2015/6/17,DO NOT BUY THIS APP.....yet.,They should not be charging this much for such a poor app. The timer stops working when you change screens so if you are on set you absolutely cannot multitask. I've just seen so many better apple apps for timecodes that I thought I'd buy this one and it'd be everything I needed- it just needs so much more work before it's even worth $2 let alone $7.50. Go search elsewhere for something better. I'll update if it ever becomes worth it.,Other than the app requiring focus (which is necessary to ensure reliable audio generation) do you have any other concerns? Regarding your opinions on the pricing I have adjusted the price to be more in line with similarly functioning iOS apps. It is now $20. Thank you for the suggestion.,2015/9/30,Gabbi Jewell,others,others,comparative review,comparative review,justify,,0
102227487,27533,com.infinite.S8.iconpack,2,2017/11/2,,Most recent update added black space into apps that use to be full looking as if they where stock. I'm now looking to replace and icon pack that I've used for months.,App works fine on all devices and masking is perfect too. Can you please send me a screenshot of the issue? Please email me at maknojiyajuned@gmail.com,2017/11/2,KDS1000,others,others,comparative review,comparative review,information request,,0
120829178,14187,com.alarmclock.xtreme,1,2018/11/16,,6.0 update did remove alot of the simple funtions and brought an annoying visual UI..,Hi thanks for your feedback. What would you like to see us add or change? Thanks in advance for your suggestions. Tereza*AVG,2018/11/24,Errorsnake,others,others,comparative review,comparative review,information request,,0
114982863,14187,com.alarmclock.xtreme,3,2018/10/21,,It used to be a great simple alarm app. Redesign is cumbersome to use. Now I'm having to look for a new alarm app.,Hi thanks for your opinion. What would you recommend us to change or add to improve the app? Thanks Tereza*AVG,2018/10/23,Chance Williams,others,others,comparative review,comparative review,information request,,0
97515135,15621,com.arkudadigital.arkmc.gm,2,2015/3/7,Does Not Work,If you have updated your nexus 7 tablet this app will no longer work as I found out  I emailed developer  they know about the problem but so far nothing. If you want to try another app I found this one easy to use and works with Nexus 7 2Player 2.0 network media player,We have done an update. All the bugs fixed!,2015/4/16,Don Turton,others,others,comparative review,comparative review,inform,,0
110502418,48859,net.floatingpoint.android.arcturus,5,2016/12/7,Great Developer,Lost all games on 5 systems when I turned off the box last night after recent update and app was installed on internal storage. Developer was quick to respond and followed up to ask questions on what was happening. My initial rating was a 1 but changed to 5 as this developer really seems to care about ensuring this app works correctly. Besides the data loss after recent update it does work well and has a very nice layout compared to other ones I have tried.,Did you install it on adopted storage? That doesn't work due to an Android bug and can cause data loss. If you want a refund send an e-mail to support@ldxtech.net. If you still want to use it though make sure it isn't installed on adopted storage. As far as I know that's the only thing that can cause data loss.,2016/12/6,Paul M,others,others,comparative review,comparative review,unspecify,,0
136938,106302227,com.runtastic.android.squats.pro,3,2017/11/27 0:00,,This app could be much better if you let the user have his or her own plan of own sets and reps. The fixed number of squats isn't helpful to grow muscles. Try to look at the layouts of other squat apps to make it even better. Thanks,Hello thank you very much for you honest feedback! In order to get a plan please check out our Leg Trainer and Butt Trainer app which will provide you with a training plan to reach your goal. Try it out and let us know how you like it. Your Runtastic Team,2017/11/30 0:00,gurinder singh,others,others,comparative review,comparative review,,,0
145501,106736026,com.skiracer.nautical_astore_us,2,2016/6/11 0:00,,But they have made the Detroit river a hot mess. Lots of missing detail important to safe navigation (underwater obstructions and pilings) and lots of F(null)R and stuff like that. Would be not an issue if I could switch back to the official charts when I need them. Downloaded another app to get that functionality back. (Correction: They're there they're just barely possible to see when you're outside because there's about zero contrast rendering them absolutely pointless. I sent emailed pictures with rough lat longs comparing the difference between the competing app and this one to their support team),You should see obstructions and piles in Detroit river on zoom in. Can you please let me know the lat lon of a point so that I can follow up on it? - Tap menu/over flow button on top right and select Settings - Check Display Lat Lon Bar  - Tap Save support@gpsnauticalcharts.com,2016/6/11 0:00,Paul Timmins,others,others,comparative review,comparative review,,,0
219120,111558896,xsoftstudio.musicplayer.pro,3,2018/8/27 0:00,,Nice App . Only If you could work on the equilizer .. just like the one they have in the Poweramp it would be great !!,,,Rudr Thakur,others,others,comparative review,comparative review,,,0
109519974,46031,dyna.logix.wear.inactivity.tracker.stand.up.alert,4,2016/1/10,Great app for anyone with a desk job!,I love this app. It functions extremely well and it's intuitively designed. One feature I would like to see is the ability to automatically disable it on certain days of the week. While I find it great for the office during the week I'd rather not be reminded of my inactivity while loafing on the weekends.,Good idea! UPDATE: I added the days selector. Please update to v1.14 to get it. If using Bubble Clouds update that to version 5 too!,2016/1/20,Bradley Carter,experience,experience,customization limitation,customization limitation,inform,,0
107920130,41818,com.tmsoft.whitenoise.full,5,2018/10/8,,Well worth the money. Excellent tool for sleep and meditation. Customizable with an intuitive interface. An all time favorite app.,Thank you so much for the wonderful review! We are so glad White Noise is helping you sleep and meditate better and that you are loving the app!,2018/10/9,Mary Alice Madaris,experience,experience,customization limitation,customization limitation,apology or appreciation,,0
96391575,11919,bitsykolayers.piereligio.mdm,5,2017/4/6,,Instagram still white in latest update?! Edit: meant theme doesn't apply  can you also add pixel dialer to themed apps since I'm using pixel I think it will looks nice :) thanks for fast reply cheers:) Edited: sorry for not giving fine explanation the dialer is themed but I thought maybe we can theme the blue background when you are receiving a call or calling someone to dark one :) thanks.,You mean the statusbar? Really latest update doesn't install at all for Instagram. I did an error that I fixed locally now Pixel dialer? Google dialer now looks like the one in the pixel phones and is themed EDIT: oh i see. I dunno I like it very much in this blue. I may make it darker only on blackstocktheme,2017/4/6,Alaa Sabie,experience,experience,customization limitation,customization limitation,inform,,0
110394446,48529,mpp.android.wemo,3,2015/11/9,,The looks do need to be improved drastically. Just cause its semi home brew doesn't mean we don't want some nice aesthetics. I refunded because I really want voice only control but its not quite there yet too many steps. I doubt this is the developer's fault as the gates haven't really been opened on Google Now. I've have kept an eye on this app for awhile its always improving.,Since it's better to use custom images on the widgets for an automation console - there's seldom any need to use my dump truck ugly UI - I do try to focus on usability instead. I have asked google talk for custom voice commands via their process if/when they provide them I'll update the app. For now it does take a few extra words.,2015/11/10,Royce Rogers,experience,experience,customization limitation,customization limitation,apology or appreciation/promise,退款，回复很实诚,0
101533475,25704,com.groundupworks.partyphotobooth,3,2014/11/11,Background Color Font color style size,I hope you provide more themes for the picture background and different font styles and colors. I'll give you a 5 star then. :),Working on font/theming. Discussions on our Facebook Page :) https://www.facebook.com/groundupworks,2015/1/1,karla zapanta,experience,experience,customization limitation,customization limitation,promise,,0
102951709,29408,com.klinker.android.twitter_l,5,2018/6/19,,This app is very customizable which I like UI and colors. There does seem to be a bug where I dont see group chats in my Direct Messages.,Twitter doesn't give third party apps access to group direct messages unfortunately.,2018/6/19,Misha,experience,experience,customization limitation,customization limitation,justify,,0
110501884,48839,net.dinglisch.android.taskerm,5,2018/8/30,,Love Tasker. Makes life so much easier. One issue of late. I can no longer adjust the screen brightness when Auto Brightness is on. I used to be able to. Intentional? Any fix or workaround available? Cheers!,Use the Custom Setting action and use the option to automatically find the setting and you should be good :),2018/9/10,Ray Anthony Neill,experience,experience,customization limitation,customization limitation,advice,,0
113438215,56407,flux.substratum.theme,5,2017/7/28,,Hey tried selecting dark but still shows only default color and not dark,Hello Krishnakumar! Check the play screenshots it shows Default and Black.,2017/7/29,Krishnakumar KR,experience,experience,customization limitation,customization limitation,advice,,0
112063309,53189,com.daylightclock.android.license,3,2016/12/16,Best sun clock but could be much better,This is the best sun clock or day/night map on Android. This shows how really poor the choice is compared to Windows 10 where a day/night map is built into the clock! I have the following requests: 1. Add a widget so a simple map can be on my home screen. Add world clock functionality.,Thanks for the suggestions. Multiple-location clock functionality is already on our to-do list but it adds another dimension to an already-complicated app so it's not trivial to deliver. And we'll look into doing a map widget!,2016/12/16,A Google user,experience,experience,customization limitation,customization limitation,promise/advice,,0
105538012,35847,com.plumamazing.iwatermarkplus,5,2016/7/1,Pretty easy and straightforward,Make for watermarking photos straightforward and quick. Recommended.,Thanks for the recommendation. It helps us continue improving supports our programming and ultimately gets you a better app with each new version.,2016/7/20,Tam Shah,experience,experience,customization limitation,customization limitation,apology or appreciation,,0
